{
  "source": "agribalyse-3.2",
  "target": "ecoinvent-3.9.1",
  "title": "Agribalyse 3.2 → ecoinvent 3.9.1 technosphere links",
  "target_proprietary": true,
  "schema_version": "0.2.0",
  "packages": [
    {
      "file": "technosphere.json",
      "kind": "technosphere",
      "order": 1,
      "entries": 0
    }
  ]
}
